{
  "artifact_type": "runtime_safety_observation",
  "schema_version": "0.1",
  "observation_id": "runtime_observation_demo_blocked_001",
  "observed_at": "2026-05-18T00:00:00Z",
  "expires_at": "2026-05-18T00:05:00Z",
  "provider": {
    "provider_id": "deterministic-reputation-provider",
    "provider_kind": "reputation_provider",
    "provider_version": "deterministic-0.1",
    "response_status": "usable",
    "checked_at": "2026-05-18T00:00:00Z"
  },
  "destination": {
    "destination_host": "acme.example",
    "destination_url": "https://acme.example/pay?runtime=blocked",
    "fingerprint": "acm...ple",
    "final_url": "https://acme.example/pay?runtime=blocked",
    "final_host": "acme.example",
    "observed_redirect_hops": 0,
    "https_status": "valid"
  },
  "verdict": "blocked",
  "risk_score": 70,
  "reason_codes": [
    "runtime_reputation_blocked"
  ],
  "privacy": {
    "payload_disclosure": "host_only",
    "user_data_disclosure": "none",
    "raw_provider_payload_retained": false
  },
  "decision_role": {
    "source_of_truth": false,
    "scanner_visible_impact": "may_block_to_red",
    "operator_note": "Explicit runtime block can force red after issuer and destination checks pass."
  },
  "governance": {
    "root_program_id": "root:qrtrust-demo:2026",
    "delegated_authority_id": "authority:qrtrust-demo:merchant-web",
    "issuer_id": "issuer:acme-demo",
    "destination_policy_id": "policy:acme-demo:web-payments:v1"
  }
}
